{
  "schema_version": "1.0.0",
  "generated_by": "mock",
  "generated_at": "2026-07-15T02:30:00Z",
  "origin_date": "2026-07-03",
  "realized": [
    {
      "horizon": 1,
      "forecast_date": "2026-07-06",
      "realized_value": -0.000571
    },
    {
      "horizon": 5,
      "forecast_date": "2026-07-10",
      "realized_value": 0.01685
    }
  ],
  "predictions": [
    {
      "schema_version": "1.0.0",
      "origin_date": "2026-07-03",
      "origin_timestamp": "2026-07-03T20:00:00Z",
      "submission_timestamp": "2026-07-03T20:15:00Z",
      "method": "naive",
      "model": null,
      "predictor_id": "sp500_naive",
      "horizons": [
        {
          "horizon": 1,
          "point_estimate": 0.0,
          "quantiles": [
            {
              "quantile": 0.05,
              "value": -0.02081
            },
            {
              "quantile": 0.1,
              "value": -0.016214
            },
            {
              "quantile": 0.2,
              "value": -0.010648
            },
            {
              "quantile": 0.3,
              "value": -0.006635
            },
            {
              "quantile": 0.4,
              "value": -0.003205
            },
            {
              "quantile": 0.5,
              "value": 0.0
            },
            {
              "quantile": 0.6,
              "value": 0.003205
            },
            {
              "quantile": 0.7,
              "value": 0.006635
            },
            {
              "quantile": 0.8,
              "value": 0.010648
            },
            {
              "quantile": 0.9,
              "value": 0.016214
            },
            {
              "quantile": 0.95,
              "value": 0.02081
            }
          ]
        },
        {
          "horizon": 5,
          "point_estimate": 0.0,
          "quantiles": [
            {
              "quantile": 0.05,
              "value": -0.047323
            },
            {
              "quantile": 0.1,
              "value": -0.036871
            },
            {
              "quantile": 0.2,
              "value": -0.024214
            },
            {
              "quantile": 0.3,
              "value": -0.015087
            },
            {
              "quantile": 0.4,
              "value": -0.007289
            },
            {
              "quantile": 0.5,
              "value": 0.0
            },
            {
              "quantile": 0.6,
              "value": 0.007289
            },
            {
              "quantile": 0.7,
              "value": 0.015087
            },
            {
              "quantile": 0.8,
              "value": 0.024214
            },
            {
              "quantile": 0.9,
              "value": 0.036871
            },
            {
              "quantile": 0.95,
              "value": 0.047323
            }
          ]
        },
        {
          "horizon": 21,
          "point_estimate": 0.0,
          "quantiles": [
            {
              "quantile": 0.05,
              "value": -0.102733
            },
            {
              "quantile": 0.1,
              "value": -0.080042
            },
            {
              "quantile": 0.2,
              "value": -0.052565
            },
            {
              "quantile": 0.3,
              "value": -0.032752
            },
            {
              "quantile": 0.4,
              "value": -0.015823
            },
            {
              "quantile": 0.5,
              "value": 0.0
            },
            {
              "quantile": 0.6,
              "value": 0.015823
            },
            {
              "quantile": 0.7,
              "value": 0.032752
            },
            {
              "quantile": 0.8,
              "value": 0.052565
            },
            {
              "quantile": 0.9,
              "value": 0.080042
            },
            {
              "quantile": 0.95,
              "value": 0.102733
            }
          ]
        }
      ],
      "rationale": "",
      "curated_trace_summary": {
        "tool_calls": []
      },
      "langfuse_trace_id": null
    },
    {
      "schema_version": "1.0.0",
      "origin_date": "2026-07-03",
      "origin_timestamp": "2026-07-03T20:00:00Z",
      "submission_timestamp": "2026-07-03T20:32:00Z",
      "method": "classical",
      "model": null,
      "predictor_id": "sp500_classical",
      "horizons": [
        {
          "horizon": 1,
          "point_estimate": 0.002467,
          "quantiles": [
            {
              "quantile": 0.05,
              "value": -0.014898
            },
            {
              "quantile": 0.1,
              "value": -0.011062
            },
            {
              "quantile": 0.2,
              "value": -0.006418
            },
            {
              "quantile": 0.3,
              "value": -0.003069
            },
            {
              "quantile": 0.4,
              "value": -0.000208
            },
            {
              "quantile": 0.5,
              "value": 0.002467
            },
            {
              "quantile": 0.6,
              "value": 0.005142
            },
            {
              "quantile": 0.7,
              "value": 0.008003
            },
            {
              "quantile": 0.8,
              "value": 0.011352
            },
            {
              "quantile": 0.9,
              "value": 0.015996
            },
            {
              "quantile": 0.95,
              "value": 0.019832
            }
          ]
        },
        {
          "horizon": 5,
          "point_estimate": -0.001018,
          "quantiles": [
            {
              "quantile": 0.05,
              "value": -0.04242
            },
            {
              "quantile": 0.1,
              "value": -0.033276
            },
            {
              "quantile": 0.2,
              "value": -0.022202
            },
            {
              "quantile": 0.3,
              "value": -0.014217
            },
            {
              "quantile": 0.4,
              "value": -0.007395
            },
            {
              "quantile": 0.5,
              "value": -0.001018
            },
            {
              "quantile": 0.6,
              "value": 0.005359
            },
            {
              "quantile": 0.7,
              "value": 0.012182
            },
            {
              "quantile": 0.8,
              "value": 0.020167
            },
            {
              "quantile": 0.9,
              "value": 0.03124
            },
            {
              "quantile": 0.95,
              "value": 0.040385
            }
          ]
        },
        {
          "horizon": 21,
          "point_estimate": 0.005776,
          "quantiles": [
            {
              "quantile": 0.05,
              "value": -0.078157
            },
            {
              "quantile": 0.1,
              "value": -0.059618
            },
            {
              "quantile": 0.2,
              "value": -0.03717
            },
            {
              "quantile": 0.3,
              "value": -0.020983
            },
            {
              "quantile": 0.4,
              "value": -0.007151
            },
            {
              "quantile": 0.5,
              "value": 0.005776
            },
            {
              "quantile": 0.6,
              "value": 0.018704
            },
            {
              "quantile": 0.7,
              "value": 0.032535
            },
            {
              "quantile": 0.8,
              "value": 0.048722
            },
            {
              "quantile": 0.9,
              "value": 0.071171
            },
            {
              "quantile": 0.95,
              "value": 0.089709
            }
          ]
        }
      ],
      "rationale": "",
      "curated_trace_summary": {
        "tool_calls": []
      },
      "langfuse_trace_id": null
    },
    {
      "schema_version": "1.0.0",
      "origin_date": "2026-07-03",
      "origin_timestamp": "2026-07-03T20:00:00Z",
      "submission_timestamp": "2026-07-03T20:25:00Z",
      "method": "lightgbm",
      "model": null,
      "predictor_id": "sp500_lightgbm",
      "horizons": [
        {
          "horizon": 1,
          "point_estimate": 0.001979,
          "quantiles": [
            {
              "quantile": 0.05,
              "value": -0.013964
            },
            {
              "quantile": 0.1,
              "value": -0.010442
            },
            {
              "quantile": 0.2,
              "value": -0.006178
            },
            {
              "quantile": 0.3,
              "value": -0.003104
            },
            {
              "quantile": 0.4,
              "value": -0.000476
            },
            {
              "quantile": 0.5,
              "value": 0.001979
            },
            {
              "quantile": 0.6,
              "value": 0.004435
            },
            {
              "quantile": 0.7,
              "value": 0.007062
            },
            {
              "quantile": 0.8,
              "value": 0.010137
            },
            {
              "quantile": 0.9,
              "value": 0.014401
            },
            {
              "quantile": 0.95,
              "value": 0.017923
            }
          ]
        },
        {
          "horizon": 5,
          "point_estimate": 0.005068,
          "quantiles": [
            {
              "quantile": 0.05,
              "value": -0.031173
            },
            {
              "quantile": 0.1,
              "value": -0.023168
            },
            {
              "quantile": 0.2,
              "value": -0.013475
            },
            {
              "quantile": 0.3,
              "value": -0.006486
            },
            {
              "quantile": 0.4,
              "value": -0.000514